{
  "schema_version": 1,
  "level": "offline_demo_validated",
  "next_batch": "07",
  "batches": [
    {
      "id": "00",
      "status": "passed",
      "evidence": [
        "docs/capabilities.md",
        "validation/package-validation.json",
        "docs/evidence/worktrees-created.log"
      ],
      "checks": [
        {
          "name": "Original source/template preparation and preserved reference",
          "outcome": "passed",
          "command": "git diff --exit-code -- reference/dashboard",
          "cwd": "/workspace/learningOS",
          "exit_code": 0,
          "artifact": "validation/template-checks.json"
        },
        {
          "name": "Native features assessed and exercised honestly",
          "outcome": "passed",
          "command": "native collaboration tasks; codex --version; codex features list",
          "cwd": "/workspace/learningOS",
          "exit_code": 0,
          "artifact": "docs/evidence/native-agents.json"
        }
      ]
    },
    {
      "id": "01",
      "status": "passed",
      "evidence": [
        "docs/evidence/fresh-copy.json"
      ],
      "checks": [
        {
          "name": "104 deterministic backend/SQLite/PostgreSQL checks; zero skips",
          "outcome": "passed",
          "command": "UV_CACHE_DIR=/tmp/learningos-uv-cache TEST_POSTGRES_URL=<isolated-synthetic-postgres> backend/.venv/bin/python -m pytest -q backend/tests",
          "cwd": "/workspace/learningOS",
          "exit_code": 0,
          "artifact": "docs/evidence/backend-tests.log"
        },
        {
          "name": "Functional API+worker+actual supplied Home startup",
          "outcome": "passed",
          "command": "LEARNING_OS_RUNTIME_DIR=.runtime/review-runtime API_PORT=8040 WEB_PORT=3040 bash scripts/dev.sh",
          "cwd": "/workspace/learningOS",
          "exit_code": 0,
          "artifact": "docs/evidence/browser/results.json"
        },
        {
          "name": "Frozen full clean-copy check",
          "outcome": "passed",
          "command": "TEST_POSTGRES_URL=<isolated-synthetic-postgres> bash scripts/check.sh",
          "cwd": "/workspace/learningOS/.runtime/fresh-checkout",
          "exit_code": 0,
          "artifact": "docs/evidence/fresh-checks.log"
        }
      ]
    },
    {
      "id": "02",
      "status": "passed",
      "evidence": [
        "docs/evidence/browser/ui-upload-receipt.png"
      ],
      "checks": [
        {
          "name": "104 deterministic backend/SQLite/PostgreSQL checks; zero skips",
          "outcome": "passed",
          "command": "UV_CACHE_DIR=/tmp/learningos-uv-cache TEST_POSTGRES_URL=<isolated-synthetic-postgres> backend/.venv/bin/python -m pytest -q backend/tests",
          "cwd": "/workspace/learningOS",
          "exit_code": 0,
          "artifact": "docs/evidence/backend-tests.log"
        },
        {
          "name": "Real UI upload, worker, original citation and lost-receipt dedup",
          "outcome": "passed",
          "command": "E2E_BASE_URL=http://127.0.0.1:3040 python tests/e2e_smoke.py",
          "cwd": "/workspace/learningOS",
          "exit_code": 0,
          "artifact": "docs/evidence/browser/results.json"
        }
      ]
    },
    {
      "id": "03",
      "status": "passed",
      "evidence": [
        "docs/evidence/browser/ui-study-five-title-scope.png",
        "docs/evidence/frontend/journeys.json"
      ],
      "checks": [
        {
          "name": "104 deterministic backend/SQLite/PostgreSQL checks; zero skips",
          "outcome": "passed",
          "command": "UV_CACHE_DIR=/tmp/learningos-uv-cache TEST_POSTGRES_URL=<isolated-synthetic-postgres> backend/.venv/bin/python -m pytest -q backend/tests",
          "cwd": "/workspace/learningOS",
          "exit_code": 0,
          "artifact": "docs/evidence/backend-tests.log"
        },
        {
          "name": "Five titled sections, keyboard order/reload, frozen prior scope",
          "outcome": "passed",
          "command": "E2E_BASE_URL=http://127.0.0.1:3040 python tests/e2e_smoke.py",
          "cwd": "/workspace/learningOS",
          "exit_code": 0,
          "artifact": "docs/evidence/browser/results.json"
        }
      ]
    },
    {
      "id": "04",
      "status": "passed",
      "evidence": [
        "backend/app/prompts/",
        "docs/LIVE_VERIFICATION.md"
      ],
      "checks": [
        {
          "name": "104 deterministic backend/SQLite/PostgreSQL checks; zero skips",
          "outcome": "passed",
          "command": "UV_CACHE_DIR=/tmp/learningos-uv-cache TEST_POSTGRES_URL=<isolated-synthetic-postgres> backend/.venv/bin/python -m pytest -q backend/tests",
          "cwd": "/workspace/learningOS",
          "exit_code": 0,
          "artifact": "docs/evidence/backend-tests.log"
        },
        {
          "name": "Pending English frozen, French next-turn context, immutable original citations",
          "outcome": "passed",
          "command": "UV_CACHE_DIR=/tmp/learningos-uv-cache TEST_POSTGRES_URL=<isolated-synthetic-postgres> backend/.venv/bin/python -m pytest -q backend/tests",
          "cwd": "/workspace/learningOS",
          "exit_code": 0,
          "artifact": "docs/evidence/turn-locale-tests.log"
        },
        {
          "name": "L03 proficient/native semantic review after passed live provider probes",
          "outcome": "blocked",
          "command": null,
          "cwd": "/workspace/learningOS",
          "exit_code": null,
          "artifact": "docs/evidence/connected-verification.json"
        },
        {
          "name": "All ten live text question/correct/incorrect/low-confidence provider probes (40); proficient review pending",
          "outcome": "passed",
          "command": "APP_MODE=live backend/.venv/bin/python scripts/verify_live_learning.py --allow-provider-calls --sections text,vision --private-review-dir .runtime/connected-verification/<fresh-run>/all-ten-private --report .runtime/connected-verification/<fresh-run>/all-ten-text-vision.json",
          "cwd": "/workspace/learningOS",
          "exit_code": 0,
          "artifact": "docs/evidence/connected-verification.json"
        }
      ]
    },
    {
      "id": "05",
      "status": "passed",
      "evidence": [
        "docs/session-log.md",
        "data/quiz_sets/atomic-number.json",
        "data/quiz_sets/bonding.json"
      ],
      "checks": [
        {
          "name": "104 deterministic backend/SQLite/PostgreSQL checks; zero skips",
          "outcome": "passed",
          "command": "UV_CACHE_DIR=/tmp/learningos-uv-cache TEST_POSTGRES_URL=<isolated-synthetic-postgres> backend/.venv/bin/python -m pytest -q backend/tests",
          "cwd": "/workspace/learningOS",
          "exit_code": 0,
          "artifact": "docs/evidence/backend-tests.log"
        },
        {
          "name": "Automatic summary and idempotent finish persisted",
          "outcome": "passed",
          "command": "E2E_BASE_URL=http://127.0.0.1:3040 python tests/e2e_smoke.py",
          "cwd": "/workspace/learningOS",
          "exit_code": 0,
          "artifact": "docs/evidence/browser/results.json"
        },
        {
          "name": "Automatic native Codex lifecycle hook",
          "outcome": "unrun",
          "command": null,
          "cwd": "/workspace/learningOS",
          "exit_code": null,
          "artifact": "docs/capabilities.md"
        }
      ]
    },
    {
      "id": "06",
      "status": "passed",
      "evidence": [
        "e487f122f12bfbe98b2e9931ba36e82f931c40a8",
        "117fcc36a9ff4f6c269cc2441485c560246119fb",
        "data/quiz_sets/"
      ],
      "checks": [
        {
          "name": "Two real native quiz contributions in explicitly authorized worktrees",
          "outcome": "passed",
          "command": "git worktree list --porcelain; native retrieval-practice tasks; local topic integration",
          "cwd": "/workspace/learningOS",
          "exit_code": 0,
          "artifact": "docs/evidence/worktrees-active.log"
        }
      ]
    },
    {
      "id": "07",
      "status": "blocked",
      "evidence": [
        "backend/tests/test_sources.py",
        "docs/DRIVE_INGESTION.md"
      ],
      "checks": [
        {
          "name": "104 deterministic backend/SQLite/PostgreSQL checks; zero skips",
          "outcome": "passed",
          "command": "UV_CACHE_DIR=/tmp/learningos-uv-cache TEST_POSTGRES_URL=<isolated-synthetic-postgres> backend/.venv/bin/python -m pytest -q backend/tests",
          "cwd": "/workspace/learningOS",
          "exit_code": 0,
          "artifact": "docs/evidence/backend-tests.log"
        },
        {
          "name": "UI safe URL queued during DNS outage; unsafe fetch stays guarded",
          "outcome": "passed",
          "command": "E2E_BASE_URL=http://127.0.0.1:3040 python tests/e2e_smoke.py",
          "cwd": "/workspace/learningOS",
          "exit_code": 0,
          "artifact": "docs/evidence/browser/results.json"
        },
        {
          "name": "Live D01\u2013D06 folder/UI original/manual drop/convergence/consent",
          "outcome": "blocked",
          "command": null,
          "cwd": "/workspace/learningOS",
          "exit_code": null,
          "artifact": "docs/LIVE_VERIFICATION.md"
        },
        {
          "name": "Permitted live web/captions",
          "outcome": "blocked",
          "command": null,
          "cwd": "/workspace/learningOS",
          "exit_code": null,
          "artifact": "docs/LIVE_VERIFICATION.md"
        }
      ]
    },
    {
      "id": "08",
      "status": "passed",
      "evidence": [
        "backend/app/sources/local.py",
        "scripts/verify_live_learning.py",
        "docs/evidence/connected-verification.json"
      ],
      "checks": [
        {
          "name": "104 deterministic backend/SQLite/PostgreSQL checks; zero skips",
          "outcome": "passed",